{
  "project_id": "proj_20260605_001",
  "session_id": "sess_9f8a7b6c5d",
  "novel": {
    "title": "长夜余火",
    "language": "zh-CN",
    "source_type": "plain_text",
    "content": "第一章...\n\n第二章...\n\n第三章...",
    "chapter_count_hint": 3
  },
  "generation_config": {
    "target_format": "yaml",
    "scene_granularity": "medium",
    "enable_dynamic_schema": true,
    "enable_design_reasons": true,
    "enable_camera_directions": true,
    "enable_dialogues": true,
    "enable_emotion_tags": true,
    "max_concurrent_chapters": 3,
    "max_concurrent_scenes": 6,
    "stream_mode": "scene_delta"
  },
  "output_preferences": {
    "yaml_style": "block_literal",
    "include_schema_summary": true,
    "include_scene_index": true,
    "include_character_registry": true
  },
  "client_context": {
    "timezone": "Asia/Shanghai",
    "locale": "zh-CN",
    "request_id": "req_01HXABCDEFG123456789"
  }
}
